35,User Behavior Analytics,BI/Analytics,"Funnel visualization, user flow diagrams, conversion tracking, engagement metrics, user journey mapping, cohort analysis","Funnel stage colors: high engagement (green), drop-off (red), conversion (blue), user flow arrows (grey)","Stage completion colors (success), abandonment colors (warning), engagement levels (gradient), cohort colors","Funnel animation (fill-down), flow diagram animations (connection draw), conversion pulse, engagement bar fill","Conversion funnel analysis, user journey tracking, engagement analytics, cohort analysis, retention tracking","Real-time operational metrics, technical system monitoring, financial transactions",✓ Full,✓ Full,⚡ Good,✓ WCAG AA,✓ Good,✗ Not applicable,"Recharts 9/10, Chart.js 9/10, D3.js 10/10",2020s Modern,Medium,"Design a user behavior analytics dashboard. Use: funnel visualization, user flow diagrams (Sankey), conversion metrics, engagement heatmaps, cohort tables, retention curves, session replay indicators.","SVG funnel with gradients, Sankey diagram library, percentage labels, cohort grid cells, retention chart (line/area), click heatmap overlay, session timeline","☐ Funnel stages clear, ☐ Flow diagram readable, ☐ Conversions calculated, ☐ Cohorts comparable, ☐ Retention trends visible, ☐ Privacy compliant","--funnel-width: 100%, --stage-colors: gradient, --flow-opacity: 0.6, --cohort-cell-size: 40px, --retention-line-color: #3B82F6, --engagement-scale: 5 levels"
36,Financial Dashboard,BI/Analytics,"Revenue metrics, profit/loss visualization, budget tracking, financial ratios, portfolio performance, cash flow, audit trail","Financial colors: profit (green #22C55E), loss (red #EF4444), neutral (grey), trust (dark blue #003366)","Revenue highlight (green), expenses (red), budget variance (orange/red), balance (grey), accuracy (blue)","Number animations (count-up), trend direction indicators, percentage change animations, profit/loss color transitions","Financial reporting, accounting dashboards, portfolio tracking, budget monitoring, banking analytics","Simple business dashboards, entertainment/social metrics, non-financial data",✓ Full,✓ Full,⚡ Excellent,✓ WCAG AAA,✗ Low,✗ Not applicable,"Recharts 9/10, Chart.js 9/10, D3.js 10/10",2020s Modern,Medium,"Design a financial dashboard. Use: revenue/expense charts, profit margins, budget vs actual, cash flow waterfall, financial ratios, audit trail table, currency formatting, period comparisons.","number formatting (Intl.NumberFormat), waterfall chart (positive/negative bars), variance coloring, table with totals row, sparkline for trends, sticky column headers","☐ Currency formatted, ☐ Decimals consistent, ☐ P&L clear, ☐ Budget variance shown, ☐ Audit trail complete, ☐ Export to Excel","--currency-symbol: $, --decimal-places: 2, --profit-color: #22C55E, --loss-color: #EF4444, --variance-threshold: 10%, --table-header-bg: #F3F4F6"
37,Sales Intelligence Dashboard,BI/Analytics,"Deal pipeline, sales metrics, territory performance, sales rep leaderboard, win-loss analysis, quota tracking, forecast accuracy","Sales colors: won (green), lost (red), in-progress (blue), blocked (orange), quota met (gold), quota missed (grey)","Pipeline stage colors, rep performance colors, quota achievement colors, forecast accuracy colors","Deal movement animations, metric updates, leaderboard ranking changes, gauge needle movements, status change highlights","CRM dashboards, sales management, opportunity tracking, performance management, quota planning","Marketing analytics, customer support metrics, HR dashboards",✓ Full,✓ Full,⚡ Good,✓ WCAG AA,◐ Medium,✗ Not applicable,"Recharts 9/10, Chart.js 9/10",2020s Modern,Medium,"Design a sales intelligence dashboard. Use: pipeline funnel, deal cards (kanban), quota gauges, leaderboard table, territory map, win/loss ratios, forecast accuracy, activity timeline.","kanban columns (flex), gauge chart (SVG arc), leaderboard ranking styles, map integration (Mapbox/Google), timeline vertical, deal card with status border","☐ Pipeline stages shown, ☐ Deals draggable, ☐ Quotas visualized, ☐ Rankings updated, ☐ Territory clickable, ☐ CRM integration","--pipeline-colors: stage gradient, --gauge-track: #E5E7EB, --gauge-fill: primary, --rank-1-color: #FFD700, --rank-2-color: #C0C0C0, --rank-3-color: #CD7F32"
38,Neubrutalism,General,"Bold borders, black outlines, primary colors, thick shadows, no gradients, flat colors, 45° shadows, playful, Gen Z","#FFEB3B (Yellow), #FF5252 (Red), #2196F3 (Blue), #000000 (Black borders)","Limited accent colors, high contrast combinations, no gradients allowed","box-shadow: 4px 4px 0 #000, border: 3px solid #000, no gradients, sharp corners (0px), bold typography","Gen Z brands, startups, creative agencies, Figma-style apps, Notion-style interfaces, tech blogs","Luxury brands, finance, healthcare, conservative industries (too playful)",✓ Full,✓ Full,⚡ Excellent,✓ WCAG AAA,✓ High,✓ High,"Tailwind 10/10, Bootstrap 8/10",2020s Modern,Low,"Design a neubrutalist interface. Use: high contrast, hard black borders (3px+), bright pop colors, no blur, sharp or slightly rounded corners, bold typography, hard shadows (offset 4px 4px), raw aesthetic but functional.","border: 3px solid black, box-shadow: 5px 5px 0px black, colors: #FFDB58 #FF6B6B #4ECDC4, font-weight: 700, no gradients","☐ Hard borders (2-4px), ☐ Hard offset shadows, ☐ High saturation colors, ☐ Bold typography, ☐ No blurs/gradients, ☐ Distinctive 'ugly-cute' look","--border-width: 3px, --shadow-offset: 4px, --shadow-color: #000, --colors: high saturation, --font: bold sans"
39,Bento Box Grid,General,"Modular cards, asymmetric grid, varied sizes, Apple-style, dashboard tiles, negative space, clean hierarchy, cards","Neutral base + brand accent, #FFFFFF, #F5F5F5, brand primary","Subtle gradients, shadow variations, accent highlights for interactive cards","grid-template with varied spans, rounded-xl (16px), subtle shadows, hover scale (1.02), smooth transitions","Dashboards, product pages, portfolios, Apple-style marketing, feature showcases, SaaS","Dense data tables, text-heavy content, real-time monitoring",✓ Full,✓ Full,⚡ Excellent,✓ WCAG AA,✓ High,✓ High,"Tailwind 10/10, CSS Grid 10/10",2020s Apple,Low,"Design a Bento Box grid layout. Use: modular cards with varied sizes (1x1, 2x1, 2x2), Apple-style aesthetic, rounded corners (16-24px), soft shadows, clean hierarchy, asymmetric grid, neutral backgrounds (#F5F5F7), hover effects.","display: grid, grid-template-columns: repeat(4, 1fr), grid-auto-rows: 200px, gap: 16px, border-radius: 24px, background: #FFFFFF, box-shadow: 0 4px 6px rgba(0,0,0,0.05)","☐ Grid responsive (4→2→1 cols), ☐ Card spans varied, ☐ Rounded corners consistent, ☐ Shadows subtle, ☐ Content fits cards, ☐ Hover scale (1.02)","--grid-gap: 16px, --card-radius: 24px, --card-bg: #FFFFFF, --page-bg: #F5F5F7, --shadow: 0 4px 6px rgba(0,0,0,0.05), --hover-scale: 1.02"
40,Y2K Aesthetic,General,"Neon pink, chrome, metallic, bubblegum, iridescent, glossy, retro-futurism, 2000s, futuristic nostalgia","#FF69B4 (Hot Pink), #00FFFF (Cyan), #C0C0C0 (Silver), #9400D3 (Purple)","Metallic gradients, glossy overlays, iridescent effects, chrome textures","linear-gradient metallic, glossy buttons, 3D chrome effects, glow animations, bubble shapes","Fashion brands, music platforms, Gen Z brands, nostalgia marketing, entertainment, youth-focused","B2B enterprise, healthcare, finance, conservative industries, elderly users",✓ Full,◐ Partial,⚠ Good,⚠ Check contrast,✓ Good,✓ High,"Tailwind 8/10, CSS-in-JS 9/10",Y2K 2000s,Medium,"Design a Y2K aesthetic interface. Use: neon pink/cyan colors, chrome/metallic textures, bubblegum gradients, glossy buttons, iridescent effects, 2000s futurism, star/sparkle decorations, bubble shapes, tech-optimistic vibe.","background: linear-gradient(135deg, #FF69B4, #00FFFF), filter: drop-shadow for glow, border-radius: 50% for bubbles, metallic gradients (silver/chrome), text-shadow: neon glow, ::before for sparkles","☐ Neon colors balanced, ☐ Chrome effects visible, ☐ Glossy buttons styled, ☐ Bubble shapes decorative, ☐ Sparkle animations, ☐ Retro fonts loaded","--neon-pink: #FF69B4, --neon-cyan: #00FFFF, --chrome-silver: #C0C0C0, --glossy-gradient: linear-gradient(180deg, white 0%, transparent 50%), --glow-blur: 10px"
41,Cyberpunk UI,General,"Neon, dark mode, terminal, HUD, sci-fi, glitch, dystopian, futuristic, matrix, tech noir","#00FF00 (Matrix Green), #FF00FF (Magenta), #00FFFF (Cyan), #0D0D0D (Dark)","Neon gradients, scanline overlays, glitch colors, terminal green accents","Neon glow (text-shadow), glitch animations (skew/offset), scanlines (::before overlay), terminal fonts","Gaming platforms, tech products, crypto apps, sci-fi applications, developer tools, entertainment","Corporate enterprise, healthcare, family apps, conservative brands, elderly users",✗ No,✓ Only,⚠ Moderate,⚠ Limited (dark+neon),◐ Medium,◐ Medium,"Tailwind 8/10, Custom CSS 10/10",2020s Cyberpunk,Medium,"Design a cyberpunk interface. Use: neon colors on dark (#0D0D0D), terminal/HUD aesthetic, glitch effects, scanlines overlay, matrix green accents, monospace fonts, angular shapes, dystopian tech feel.","background: #0D0D0D, color: #00FF00 or #FF00FF, font-family: monospace, text-shadow: 0 0 10px neon, animation: glitch (transform skew), ::before scanlines (repeating-linear-gradient)","☐ Dark background only, ☐ Neon accents visible, ☐ Glitch effect subtle, ☐ Scanlines optional, ☐ Monospace font, ☐ Terminal aesthetic","--bg-dark: #0D0D0D, --neon-green: #00FF00, --neon-magenta: #FF00FF, --neon-cyan: #00FFFF, --scanline-opacity: 0.1, --glitch-duration: 0.3s"
42,Organic Biophilic,General,"Nature, organic shapes, green, sustainable, rounded, flowing, wellness, earthy, natural textures","#228B22 (Forest Green), #8B4513 (Earth Brown), #87CEEB (Sky Blue), #F5F5DC (Beige)","Natural gradients, earth tones, sky blues, organic textures, wood/stone colors","Rounded corners (16-24px), organic curves (border-radius variations), natural shadows, flowing SVG shapes","Wellness apps, sustainability brands, eco products, health apps, meditation, organic food brands","Tech-focused products, gaming, industrial, urban brands",✓ Full,✓ Full,⚡ Excellent,✓ WCAG AA,✓ High,✓ High,"Tailwind 10/10, CSS 10/10",2020s Sustainable,Low,"Design a biophilic organic interface. Use: nature-inspired colors (greens, browns), organic curved shapes, rounded corners (16-24px), natural textures (wood, stone), flowing SVG elements, wellness aesthetic, earthy palette.","border-radius: 16-24px (varied), background: earth tones, SVG organic shapes (blob), box-shadow: natural soft, color: #228B22 #8B4513 #87CEEB, texture overlays (subtle)","☐ Earth tones dominant, ☐ Organic curves present, ☐ Natural textures subtle, ☐ Green accents, ☐ Rounded everywhere, ☐ Calming feel","--forest-green: #228B22, --earth-brown: #8B4513, --sky-blue: #87CEEB, --cream-bg: #F5F5DC, --organic-radius: 24px, --shadow-soft: 0 8px 32px rgba(0,0,0,0.08)"
43,AI-Native UI,General,"Chatbot, conversational, voice, assistant, agentic, ambient, minimal chrome, streaming text, AI interactions","Neutral + single accent, #6366F1 (AI Purple), #10B981 (Success), #F5F5F5 (Background)","Status indicators, streaming highlights, context card colors, subtle accent variations","Typing indicators (3-dot pulse), streaming text animations, pulse animations, context cards, smooth reveals","AI products, chatbots, voice assistants, copilots, AI-powered tools, conversational interfaces","Traditional forms, data-heavy dashboards, print-first content",✓ Full,✓ Full,⚡ Excellent,✓ WCAG AA,✓ High,✓ High,"Tailwind 10/10, React 10/10",2020s AI-Era,Low,"Design an AI-native interface. Use: minimal chrome, conversational layout, streaming text area, typing indicators (3-dot pulse), context cards, subtle AI accent color (#6366F1), clean input field, response bubbles.","chat bubble layout (flex-direction: column), typing animation (3 dots pulse), streaming text (overflow: hidden + animation), input: sticky bottom, context cards (border-left accent), minimal borders","☐ Chat layout responsive, ☐ Typing indicator smooth, ☐ Input always visible, ☐ Context cards styled, ☐ AI responses distinct, ☐ User messages aligned right","--ai-accent: #6366F1, --user-bubble-bg: #E0E7FF, --ai-bubble-bg: #F9FAFB, --input-height: 48px, --typing-dot-size: 8px, --message-gap: 16px"
44,Memphis Design,General,"80s, geometric, playful, postmodern, shapes, patterns, squiggles, triangles, neon, abstract, bold","#FF71CE (Hot Pink), #FFCE5C (Yellow), #86CCCA (Teal), #6A7BB4 (Blue Purple)","Complementary geometric colors, pattern fills, contrasting accent shapes","transform: rotate(), clip-path: polygon(), mix-blend-mode, repeating patterns, bold shapes","Creative agencies, music sites, youth brands, event promotion, artistic portfolios, entertainment","Corporate finance, healthcare, legal, elderly users, conservative brands",✓ Full,✓ Full,⚡ Excellent,⚠ Check contrast,✓ Good,◐ Medium,"Tailwind 9/10, CSS 10/10",1980s Postmodern,Medium,"Design a Memphis style interface. Use: bold geometric shapes (triangles, squiggles, circles), bright clashing colors, 80s postmodern aesthetic, playful patterns, dotted textures, asymmetric layouts, decorative elements.","clip-path: polygon() for shapes, background: repeating patterns, transform: rotate() for tilted elements, mix-blend-mode for overlays, border: dashed/dotted patterns, bold sans-serif","☐ Geometric shapes visible, ☐ Colors bold/clashing, ☐ Patterns present, ☐ Layout asymmetric, ☐ Playful decorations, ☐ 80s vibe achieved","--memphis-pink: #FF71CE, --memphis-yellow: #FFCE5C, --memphis-teal: #86CCCA, --memphis-purple: #6A7BB4, --pattern-size: 20px, --shape-rotation: 15deg"
45,Vaporwave,General,"Synthwave, retro-futuristic, 80s-90s, neon, glitch, nostalgic, sunset gradient, dreamy, aesthetic","#FF71CE (Pink), #01CDFE (Cyan), #05FFA1 (Mint), #B967FF (Purple)","Sunset gradients, glitch overlays, VHS effects, neon accents, pastel variations","text-shadow glow, linear-gradient, filter: hue-rotate(), glitch animations, retro scan lines","Music platforms, gaming, creative portfolios, tech startups, entertainment, artistic projects","Business apps, e-commerce, education, healthcare, enterprise software",✓ Full,✓ Dark focused,⚠ Moderate,⚠ Poor (motion),◐ Medium,◐ Medium,"Tailwind 8/10, CSS-in-JS 9/10",1980s-90s Retro,Medium,"Design a vaporwave aesthetic interface. Use: sunset gradients (pink/cyan/purple), 80s-90s nostalgia, glitch effects, Greek statue imagery, palm trees, grid patterns, neon glow, retro-futuristic feel, dreamy atmosphere.","background: linear-gradient(180deg, #FF71CE, #01CDFE, #B967FF), filter: hue-rotate(), text-shadow: neon glow, retro grid (perspective + linear-gradient), VHS scanlines","☐ Sunset gradient present, ☐ Neon glow applied, ☐ Retro grid visible, ☐ Glitch effects subtle, ☐ Dreamy atmosphere, ☐ 80s-90s aesthetic","--vapor-pink: #FF71CE, --vapor-cyan: #01CDFE, --vapor-mint: #05FFA1, --vapor-purple: #B967FF, --grid-color: rgba(255,255,255,0.1), --glow-intensity: 15px"
46,Dimensional Layering,General,"Depth, overlapping, z-index, layers, 3D, shadows, elevation, floating, cards, spatial hierarchy","Neutral base (#FFFFFF, #F5F5F5, #E0E0E0) + brand accent for elevated elements","Shadow variations (sm/md/lg/xl), elevation colors, highlight colors for top layers","z-index stacking, box-shadow elevation (4 levels), transform: translateZ(), backdrop-filter, parallax","Dashboards, card layouts, modals, navigation, product showcases, SaaS interfaces","Print-style layouts, simple blogs, low-end devices, flat design requirements",✓ Full,✓ Full,⚠ Good,⚠ Moderate (SR issues),✓ Good,✓ High,"Tailwind 10/10, MUI 10/10, Chakra 10/10",2020s Modern,Medium,"Design with dimensional layering. Use: z-index depth (multiple layers), overlapping cards, elevation shadows (4 levels), floating elements, parallax depth, backdrop blur for hierarchy, spatial UI feel.","z-index: 1-4 levels, box-shadow: elevation scale (sm/md/lg/xl), transform: translateZ(), backdrop-filter: blur(), position: relative for stacking, parallax on scroll","☐ Layers clearly defined, ☐ Shadows show depth, ☐ Overlaps intentional, ☐ Hierarchy clear, ☐ Performance optimized, ☐ Mobile depth maintained","--elevation-1: 0 1px 3px rgba(0,0,0,0.1), --elevation-2: 0 4px 6px rgba(0,0,0,0.1), --elevation-3: 0 10px 20px rgba(0,0,0,0.1), --elevation-4: 0 20px 40px rgba(0,0,0,0.15), --blur-amount: 8px"
47,Exaggerated Minimalism,General,"Bold minimalism, oversized typography, high contrast, negative space, loud minimal, statement design","#000000 (Black), #FFFFFF (White), single vibrant accent only","Minimal - single accent color, no secondary colors, extreme restraint","font-size: clamp(3rem 10vw 12rem), font-weight: 900, letter-spacing: -0.05em, massive whitespace","Fashion, architecture, portfolios, agency landing pages, luxury brands, editorial","E-commerce catalogs, dashboards, forms, data-heavy, elderly users, complex apps",✓ Full,✓ Full,⚡ Excellent,✓ WCAG AA,✓ High,✓ High,"Tailwind 10/10, Typography.js 10/10",2020s Modern,Low,"Design with exaggerated minimalism. Use: oversized typography (clamp 3rem-12rem), extreme negative space, black/white primary, single accent color only, bold statements, minimal elements, dramatic contrast.","font-size: clamp(3rem, 10vw, 12rem), font-weight: 900, letter-spacing: -0.05em, color: #000 or #FFF, padding: 8rem+, single accent, no decorations","☐ Typography oversized, ☐ White space extreme, ☐ Black/white dominant, ☐ Single accent only, ☐ Elements minimal, ☐ Statement clear","--type-giant: clamp(3rem, 10vw, 12rem), --type-weight: 900, --spacing-huge: 8rem, --color-primary: #000000, --color-bg: #FFFFFF, --accent: single color only"
48,Kinetic Typography,General,"Motion text, animated type, moving letters, dynamic, typing effect, morphing, scroll-triggered text","Flexible - high contrast recommended, bold colors for emphasis, animation-friendly palette","Accent colors for emphasis, transition colors, gradient text fills","@keyframes text animation, typing effect, background-clip: text, GSAP ScrollTrigger, split text","Hero sections, marketing sites, video platforms, storytelling, creative portfolios, landing pages","Long-form content, accessibility-critical, data interfaces, forms, elderly users",✓ Full,✓ Full,⚠ Moderate,❌ Poor (motion),✓ Good,✓ Very High,"GSAP 10/10, Framer Motion 10/10",2020s Modern,High,"Design with kinetic typography. Use: animated text, scroll-triggered reveals, typing effects, letter-by-letter animations, morphing text, gradient text fills, oversized hero text, text as the main visual element.","@keyframes for text animation, background-clip: text, GSAP SplitText, typing effect (steps()), transform on letters, scroll-triggered (Intersection Observer), variable fonts for morphing","☐ Text animations smooth, ☐ Prefers-reduced-motion respected, ☐ Fallback for no-JS, ☐ Mobile performance ok, ☐ Typing effect timed, ☐ Scroll triggers work","--text-animation-duration: 1s, --letter-delay: 0.05s, --typing-speed: 100ms, --gradient-text: linear-gradient(90deg, #color1, #color2), --morph-duration: 0.5s"
49,Parallax Storytelling,General,"Scroll-driven, narrative, layered scrolling, immersive, progressive disclosure, cinematic, scroll-triggered","Story-dependent, often gradients and natural colors, section-specific palettes","Section transition colors, depth layer colors, narrative mood colors","transform: translateY(scroll), position: fixed/sticky, perspective: 1px, scroll-triggered animations","Brand storytelling, product launches, case studies, portfolios, annual reports, marketing campaigns","E-commerce, dashboards, mobile-first, SEO-critical, accessibility-required",✓ Full,✓ Full,❌ Poor,❌ Poor (motion),✗ Low,✓ High,"GSAP ScrollTrigger 10/10, Locomotive Scroll 10/10",2020s Modern,High,"Design a parallax storytelling page. Use: scroll-driven narrative, layered backgrounds (3-5 layers), fixed/sticky sections, cinematic transitions, progressive disclosure, full-screen chapters, depth perception.","position: fixed/sticky, transform: translateY(calc()), perspective: 1px, z-index layering, scroll-snap-type, Intersection Observer for triggers, will-change: transform","☐ Layers parallax smoothly, ☐ Story flows naturally, ☐ Mobile alternative provided, ☐ Performance optimized, ☐ Skip option available, ☐ Reduced motion fallback","--parallax-speed-bg: 0.3, --parallax-speed-mid: 0.6, --parallax-speed-fg: 1, --section-height: 100vh, --transition-duration: 600ms, --perspective: 1px"
50,Swiss Modernism 2.0,General,"Grid system, Helvetica, modular, asymmetric, international style, rational, clean, mathematical spacing","#000000, #FFFFFF, #F5F5F5, single vibrant accent only","Minimal secondary, accent for emphasis only, no gradients","display: grid, grid-template-columns: repeat(12 1fr), gap: 1rem, mathematical ratios, clear hierarchy","Corporate sites, architecture, editorial, SaaS, museums, professional services, documentation","Playful brands, children's sites, entertainment, gaming, emotional storytelling",✓ Full,✓ Full,⚡ Excellent,✓ WCAG AAA,✓ High,✓ High,"Tailwind 10/10, Bootstrap 9/10, Foundation 10/10",1950s Swiss + 2020s,Low,"Design with Swiss Modernism 2.0. Use: strict grid system (12 columns), Helvetica/Inter fonts, mathematical spacing, asymmetric balance, high contrast, minimal decoration, clean hierarchy, single accent color.","display: grid, grid-template-columns: repeat(12, 1fr), gap: 1rem (8px base unit), font-family: Inter/Helvetica, font-weight: 400-700, color: #000/#FFF, single accent","☐ 12-column grid strict, ☐ Spacing mathematical, ☐ Typography hierarchy clear, ☐ Single accent only, ☐ No decorations, ☐ High contrast verified","--grid-columns: 12, --grid-gap: 1rem, --base-unit: 8px, --font-primary: Inter, --color-text: #000000, --color-bg: #FFFFFF, --accent: single vibrant"
51,HUD / Sci-Fi FUI,General,"Futuristic, technical, wireframe, neon, data, transparency, iron man, sci-fi, interface","Neon Cyan #00FFFF, Holographic Blue #0080FF, Alert Red #FF0000","Transparent Black, Grid Lines #333333","Glow effects, scanning animations, ticker text, blinking markers, fine line drawing","Sci-fi games, space tech, cybersecurity, movie props, immersive dashboards","Standard corporate, reading heavy content, accessible public services",✓ Low,✓ Full,⚠ Moderate (renders),⚠ Poor (thin lines),◐ Medium,✗ Low,"React 9/10, Canvas 10/10",2010s Sci-Fi,High,"Design a futuristic HUD (Heads Up Display) or FUI. Use: thin lines (1px), neon cyan/blue on black, technical markers, decorative brackets, data visualization, monospaced tech fonts, glowing elements, transparency.","border: 1px solid rgba(0,255,255,0.5), color: #00FFFF, background: transparent or rgba(0,0,0,0.8), font-family: monospace, text-shadow: 0 0 5px cyan","☐ Fine lines 1px, ☐ Neon glow text/borders, ☐ Monospaced font, ☐ Dark/Transparent BG, ☐ Decorative tech markers, ☐ Holographic feel","--hud-color: #00FFFF, --bg-color: rgba(0,10,20,0.9), --line-width: 1px, --glow: 0 0 5px, --font: monospace"
52,Pixel Art,General,"Retro, 8-bit, 16-bit, gaming, blocky, nostalgic, pixelated, arcade","Primary colors (NES Palette), brights, limited palette","Black outlines, shading via dithering or block colors","Frame-by-frame sprite animation, blinking cursor, instant transitions, marquee text","Indie games, retro tools, creative portfolios, nostalgia marketing, Web3/NFT","Professional corporate, modern SaaS, high-res photography sites",✓ Full,✓ Full,⚡ Excellent,✓ Good (if contrast ok),✓ High,◐ Medium,"CSS (box-shadow) 8/10, Canvas 10/10",1980s Arcade,Medium,"Design a pixel art inspired interface. Use: pixelated fonts, 8-bit or 16-bit aesthetic, sharp edges (image-rendering: pixelated), limited color palette, blocky UI elements, retro gaming feel.","font-family: 'Press Start 2P', image-rendering: pixelated, box-shadow: 4px 0 0 #000 (pixel border), no anti-aliasing","☐ Pixelated fonts loaded, ☐ Images sharp (no blur), ☐ CSS box-shadow for pixel borders, ☐ Retro palette, ☐ Blocky layout","--pixel-size: 4px, --font: pixel font, --border-style: pixel-shadow, --anti-alias: none"
53,Bento Grids,General,"Apple-style, modular, cards, organized, clean, hierarchy, grid, rounded, soft","Off-white #F5F5F7, Clean White #FFFFFF, Text #1D1D1F","Subtle accents, soft shadows, blurred backdrops","Hover scale (1.02), soft shadow expansion, smooth layout shifts, content reveal","Product features, dashboards, personal sites, marketing summaries, galleries","Long-form reading, data tables, complex forms",✓ Full,✓ Full,⚡ Excellent,✓ WCAG AA,✓ High,✓ High,"CSS Grid 10/10, Tailwind 10/10",2020s Apple/Linear,Low,"Design a Bento Grid layout. Use: modular grid system, rounded corners (16-24px), different card sizes (1x1, 2x1, 2x2), card-based hierarchy, soft backgrounds (#F5F5F7), subtle borders, content-first, Apple-style aesthetic.","display: grid, grid-template-columns: repeat(auto-fit, minmax(...)), gap: 1rem, border-radius: 20px, background: #FFF, box-shadow: subtle","☐ Grid layout (CSS Grid), ☐ Rounded corners 16-24px, ☐ Varied card spans, ☐ Content fits card size, ☐ Responsive re-flow, ☐ Apple-like aesthetic","--grid-gap: 20px, --card-radius: 24px, --card-bg: #FFFFFF, --page-bg: #F5F5F7, --shadow: soft"
