18,Zero Interface,General,"Minimal visible UI, voice-first, gesture-based, AI-driven, invisible controls, predictive, context-aware, ambient","Neutral backgrounds: Soft white #FAFAFA, light grey #F0F0F0, warm off-white #F5F1E8","Subtle feedback: light green, light red, minimal UI elements, soft accents","Voice recognition UI, gesture detection, AI predictions (smooth reveal), progressive disclosure, smart suggestions","Voice assistants, AI platforms, future-forward UX, smart home, contextual computing, ambient experiences","Complex workflows, data-entry heavy, traditional systems, legacy support, explicit control",✓ Full,✓ Full,⚡ Excellent,✓ Excellent,✓ High,✓ High,"Tailwind 10/10, Custom 10/10",2020s AI-Era,Low,"Create a voice-first, gesture-based, AI-driven interface with minimal visible UI, progressive disclosure, voice recognition UI, gesture detection, AI predictions, smart suggestions, context-aware actions. Hide controls until needed.","voice-commands: Web Speech API, gesture-detection: touch events, AI-predictions: hidden by default (reveal on hover), progressive-disclosure: show on demand, minimal UI visible","☐ Voice commands responsive, ☐ Gesture detection active, ☐ AI predictions hidden/revealed, ☐ Progressive disclosure working, ☐ Minimal visible UI, ☐ Smart suggestions contextual","--voice-ui: enabled, --gesture-detection: active, --ai-predictions: smart, --progressive-disclosure: true, --visible-ui: minimal, --context-aware: true"
19,Soft UI Evolution,General,"Evolved soft UI, better contrast, modern aesthetics, subtle depth, accessibility-focused, improved shadows, hybrid","Improved contrast pastels: Soft Blue #87CEEB, Soft Pink #FFB6C1, Soft Green #90EE90, better hierarchy","Better combinations, accessible secondary, supporting with improved contrast, modern accents","Improved shadows (softer than flat, clearer than neumorphism), modern (200-300ms), focus visible, WCAG AA/AAA","Modern enterprise apps, SaaS platforms, health/wellness, modern business tools, professional, hybrid","Extreme minimalism, critical performance, systems without modern OS",✓ Full,✓ Full,⚡ Excellent,✓ WCAG AA+,✓ High,✓ High,"Tailwind 9/10, MUI 9/10, Chakra 9/10",2020s Modern,Medium,"Design evolved neumorphism with improved contrast (WCAG AA+), modern aesthetics, subtle depth, accessibility focus. Use soft shadows (softer than flat but clearer than pure neumorphism), better color hierarchy, improved focus states, modern 200-300ms animations.","box-shadow: softer multi-layer (0 2px 4px), background: improved contrast pastels, border-radius: 8-12px, animation: 200-300ms smooth, outline: 2-3px on focus, contrast: 4.5:1+","☐ Improved contrast AA/AAA, ☐ Soft shadows modern, ☐ Border-radius 8-12px, ☐ Animations 200-300ms, ☐ Focus states visible, ☐ Color hierarchy clear","--shadow-soft: modern blend, --border-radius: 10px, --animation-duration: 200-300ms, --contrast-ratio: 4.5:1+, --color-hierarchy: improved, --wcag-level: AA+"
20,Hero-Centric Design,Landing Page,"Large hero section, compelling headline, high-contrast CTA, product showcase, value proposition, hero image/video, dramatic visual","Brand primary color, white/light backgrounds for contrast, accent color for CTA","Supporting colors for secondary CTAs, accent highlights, trust elements (testimonials, logos)","Smooth scroll reveal, fade-in animations on hero, subtle background parallax, CTA glow/pulse effect","SaaS landing pages, product launches, service landing pages, B2B platforms, tech companies","Complex navigation, multi-page experiences, data-heavy applications",✓ Full,✓ Full,⚡ Good,✓ WCAG AA,✓ Full,✓ Very High,"Tailwind 10/10, Bootstrap 9/10",2020s Modern,Medium,"Design a hero-centric landing page. Use: full-width hero section, compelling headline (60-80 chars), high-contrast CTA button, product screenshot or video, value proposition above fold, gradient or image background, clear visual hierarchy.","min-height: 100vh, display: flex, align-items: center, background: linear-gradient or image, text-shadow for readability, max-width: 800px for text, button with hover scale (1.05)","☐ Hero section full viewport height, ☐ Headline visible above fold, ☐ CTA button high contrast, ☐ Background image optimized (WebP), ☐ Text readable on background, ☐ Mobile responsive layout","--hero-min-height: 100vh, --headline-size: clamp(2rem, 5vw, 4rem), --cta-padding: 1rem 2rem, --overlay-opacity: 0.5, --text-shadow: 0 2px 4px rgba(0,0,0,0.3)"
21,Conversion-Optimized,Landing Page,"Form-focused, minimalist design, single CTA focus, high contrast, urgency elements, trust signals, social proof, clear value","Primary brand color, high-contrast white/light backgrounds, warning/urgency colors for time-limited offers","Secondary CTA color (muted), trust element colors (testimonial highlights), accent for key benefits","Hover states on CTA (color shift, slight scale), form field focus animations, loading spinner, success feedback","E-commerce product pages, free trial signups, lead generation, SaaS pricing pages, limited-time offers","Complex feature explanations, multi-product showcases, technical documentation",✓ Full,✓ Full,⚡ Excellent,✓ WCAG AA,✓ Full (mobile-optimized),✓ Very High,"Tailwind 10/10, Bootstrap 9/10",2020s Modern,Medium,"Design a conversion-optimized landing page. Use: single primary CTA, minimal distractions, trust badges, urgency elements (limited time), social proof (testimonials), clear value proposition, form above fold, progress indicators.","form with focus states, input:focus ring, button: primary color high contrast, position: sticky for CTA, max-width: 600px for form, loading spinner, success/error states","☐ Single primary CTA visible, ☐ Form fields minimal (3-5), ☐ Trust badges present, ☐ Social proof above fold, ☐ Mobile form optimized, ☐ Loading states implemented, ☐ A/B test ready","--cta-color: high contrast primary, --form-max-width: 600px, --input-height: 48px, --focus-ring: 3px solid accent, --success-color: #22C55E, --error-color: #EF4444"
22,Feature-Rich Showcase,Landing Page,"Multiple feature sections, grid layout, benefit cards, visual feature demonstrations, interactive elements, problem-solution pairs","Primary brand, bright secondary colors for feature cards, contrasting accent for CTAs","Supporting colors for: benefits (green), problems (red/orange), features (blue/purple), social proof (neutral)","Card hover effects (lift/scale), icon animations on scroll, feature toggle animations, smooth section transitions","Enterprise SaaS, software tools landing pages, platform services, complex product explanations, B2B products","Simple product pages, early-stage startups with few features, entertainment landing pages",✓ Full,✓ Full,⚡ Good,✓ WCAG AA,✓ Good,✓ High,"Tailwind 10/10, Bootstrap 9/10",2020s Modern,Medium,"Design a feature showcase landing page. Use: grid layout for features (3-4 columns), feature cards with icons, benefit-focused copy, alternating sections, comparison tables, interactive demos, problem-solution pairs.","display: grid, grid-template-columns: repeat(auto-fit, minmax(280px, 1fr)), gap: 2rem, card hover effects (translateY -4px), icon containers, alternating background colors","☐ Feature grid responsive, ☐ Icons consistent style, ☐ Card hover effects smooth, ☐ Alternating sections contrast, ☐ Benefits clearly stated, ☐ Mobile stacks properly","--card-padding: 2rem, --card-radius: 12px, --icon-size: 48px, --grid-gap: 2rem, --section-padding: 4rem 0, --hover-transform: translateY(-4px)"
23,Minimal & Direct,Landing Page,"Minimal text, white space heavy, single column layout, direct messaging, clean typography, visual-centric, fast-loading","Monochromatic primary, white background, single accent color for CTA, black/dark grey text","Minimal secondary colors, reserved for critical CTAs only, neutral supporting elements","Very subtle hover effects, minimal animations, fast page load (no heavy animations), smooth scroll","Simple service landing pages, indie products, consulting services, micro SaaS, freelancer portfolios","Feature-heavy products, complex explanations, multi-product showcases",✓ Full,✓ Full,⚡ Excellent,✓ WCAG AAA,✓ Full,✓ High,"Tailwind 10/10, Bootstrap 9/10",2020s Modern,Medium,"Design a minimal direct landing page. Use: single column layout, maximum white space, essential content only, one CTA, clean typography, no decorative elements, fast loading, direct messaging.","max-width: 680px, margin: 0 auto, padding: 4rem 2rem, font-size: 18-20px, line-height: 1.6, minimal animations, no box-shadow, clean borders only","☐ Single column centered, ☐ White space generous, ☐ One primary CTA only, ☐ No decorative images, ☐ Page weight < 500KB, ☐ Load time < 2s","--content-max-width: 680px, --spacing-large: 4rem, --font-size-body: 18px, --line-height: 1.6, --color-text: #1a1a1a, --color-bg: #ffffff"
24,Social Proof-Focused,Landing Page,"Testimonials prominent, client logos displayed, case studies sections, reviews/ratings, user avatars, success metrics, credibility markers","Primary brand, trust colors (blue), success/growth colors (green), neutral backgrounds","Testimonial highlight colors, logo grid backgrounds (light grey), badge/achievement colors","Testimonial carousel animations, logo grid fade-in, stat counter animations (number count-up), review star ratings","B2B SaaS, professional services, premium products, e-commerce conversion pages, established brands","Startup MVPs, products without users, niche/experimental products",✓ Full,✓ Full,⚡ Good,✓ WCAG AA,✓ Full,✓ High,"Tailwind 10/10, Bootstrap 9/10",2020s Modern,Medium,"Design a social proof landing page. Use: testimonials with photos, client logos grid, case study cards, review ratings (stars), user count metrics, success stories, trust indicators, before/after comparisons.","testimonial cards with avatar, logo grid (grayscale filter), star rating SVGs, counter animations (count-up), blockquote styling, carousel for testimonials, metric cards","☐ Testimonials with real photos, ☐ Logo grid 6-12 logos, ☐ Star ratings accessible, ☐ Metrics animated on scroll, ☐ Case studies linked, ☐ Mobile carousel works","--avatar-size: 64px, --logo-height: 40px, --star-color: #FBBF24, --metric-font-size: 3rem, --testimonial-bg: #F9FAFB, --blockquote-border: 4px solid accent"
25,Interactive Product Demo,Landing Page,"Embedded product mockup/video, interactive elements, product walkthrough, step-by-step guides, hover-to-reveal features, embedded demos","Primary brand, interface colors matching product, demo highlight colors for interactive elements","Product UI colors, tutorial step colors (numbered progression), hover state indicators","Product animation playback, step progression animations, hover reveal effects, smooth zoom on interaction","SaaS platforms, tool/software products, productivity apps landing pages, developer tools, productivity software","Simple services, consulting, non-digital products, complexity-averse audiences",✓ Full,✓ Full,⚠ Good (video/interactive),✓ WCAG AA,✓ Good,✓ Very High,"Tailwind 10/10, Bootstrap 9/10",2020s Modern,Medium,"Design an interactive demo landing page. Use: embedded product mockup, video walkthrough, step-by-step guide, hover-to-reveal features, live demo button, screenshot carousel, feature highlights on interaction.","video element with controls, position: relative for overlays, hover reveal (opacity transition), step indicators, modal for full demo, screenshot lightbox, play button overlay","☐ Demo video loads fast, ☐ Fallback for no-JS, ☐ Step indicators clear, ☐ Hover states obvious, ☐ Mobile touch friendly, ☐ Demo CTA prominent","--video-aspect-ratio: 16/9, --overlay-bg: rgba(0,0,0,0.7), --step-indicator-size: 32px, --play-button-size: 80px, --transition-duration: 300ms"
26,Trust & Authority,Landing Page,"Certificates/badges displayed, expert credentials, case studies with metrics, before/after comparisons, industry recognition, security badges","Professional colors (blue/grey), trust colors, certification badge colors (gold/silver accents)","Certificate highlight colors, metric showcase colors, comparison highlight (success green)","Badge hover effects, metric pulse animations, certificate carousel, smooth stat reveal","Healthcare/medical landing pages, financial services, enterprise software, premium/luxury products, legal services","Casual products, entertainment, viral/social-first products",✓ Full,✓ Full,⚡ Excellent,✓ WCAG AAA,✓ Full,✓ High,"Tailwind 10/10, Bootstrap 9/10",2020s Modern,Medium,"Design a trust-focused landing page. Use: certification badges, security indicators, expert credentials, industry awards, case study metrics, compliance logos (GDPR, SOC2), guarantee badges, professional photography.","badge grid layout, shield icons, lock icons for security, certificate styling, metric cards with icons, professional color scheme (blue/grey), subtle shadows for depth","☐ Security badges visible, ☐ Certifications verified, ☐ Metrics with sources, ☐ Professional imagery, ☐ Guarantee clearly stated, ☐ Contact info accessible","--badge-height: 48px, --trust-color: #1E40AF, --security-green: #059669, --card-shadow: 0 4px 6px rgba(0,0,0,0.1), --metric-highlight: #F59E0B"
27,Storytelling-Driven,Landing Page,"Narrative flow, visual story progression, section transitions, consistent character/brand voice, emotional messaging, journey visualization","Brand primary, warm/emotional colors, varied accent colors per story section, high visual variety","Story section color coding, emotional state colors (calm, excitement, success), transitional gradients","Section-to-section animations, scroll-triggered reveals, character/icon animations, morphing transitions, parallax narrative","Brand/startup stories, mission-driven products, premium/lifestyle brands, documentary-style products, educational","Technical/complex products (unless narrative-driven), traditional enterprise software",✓ Full,✓ Full,⚠ Moderate (animations),✓ WCAG AA,✓ Good,✓ High,"Tailwind 10/10, Bootstrap 9/10",2020s Modern,Medium,"Design a storytelling landing page. Use: narrative flow sections, scroll-triggered reveals, chapter-like structure, emotional imagery, brand journey visualization, founder story, mission statement, timeline progression.","scroll-snap sections, Intersection Observer for reveals, parallax backgrounds, section transitions, timeline CSS, narrative typography (varied sizes), image-text alternating","☐ Story flows naturally, ☐ Scroll reveals smooth, ☐ Sections timed well, ☐ Emotional hooks present, ☐ Mobile story readable, ☐ Skip option available","--section-min-height: 100vh, --reveal-duration: 600ms, --narrative-font: serif, --chapter-spacing: 8rem, --timeline-color: accent, --parallax-speed: 0.5"
28,Data-Dense Dashboard,BI/Analytics,"Multiple charts/widgets, data tables, KPI cards, minimal padding, grid layout, space-efficient, maximum data visibility","Neutral primary (light grey/white #F5F5F5), data colors (blue/green/red), dark text #333333","Chart colors: success (green #22C55E), warning (amber #F59E0B), alert (red #EF4444), neutral (grey)","Hover tooltips, chart zoom on click, row highlighting on hover, smooth filter animations, data loading spinners","Business intelligence dashboards, financial analytics, enterprise reporting, operational dashboards, data warehousing","Marketing dashboards, consumer-facing analytics, simple reporting",✓ Full,✓ Full,⚡ Excellent,✓ WCAG AA,◐ Medium,✗ Not applicable,"Recharts 9/10, Chart.js 9/10, D3.js 10/10",2020s Modern,Medium,"Design a data-dense dashboard. Use: multiple chart widgets, KPI cards row, data tables with sorting, minimal padding (8-12px), efficient grid layout, filter sidebar, dense but readable typography, maximum information density.","display: grid, grid-template-columns: repeat(12, 1fr), gap: 8px, padding: 12px, font-size: 12-14px, overflow: auto for tables, compact card design, sticky headers","☐ Grid layout 12 columns, ☐ KPI cards responsive, ☐ Tables sortable, ☐ Filters functional, ☐ Loading states for data, ☐ Export functionality","--grid-gap: 8px, --card-padding: 12px, --font-size-small: 12px, --table-row-height: 36px, --sidebar-width: 240px, --header-height: 56px"
29,Heat Map & Heatmap Style,BI/Analytics,"Color-coded grid/matrix, data intensity visualization, geographical heat maps, correlation matrices, cell-based representation, gradient coloring","Gradient scale: Cool (blue #0080FF) to hot (red #FF0000), neutral middle (white/yellow)","Support gradients: Light (cool blue) to dark (warm red), divergent for positive/negative data, monochromatic options","Color gradient transitions on data change, cell highlighting on hover, tooltip reveal on click, smooth color animation","Geographical analysis, performance matrices, correlation analysis, user behavior heatmaps, temperature/intensity data","Linear data representation, categorical comparisons (use bar charts), small datasets",✓ Full,✓ Full (with adjustments),⚡ Excellent,⚠ Colorblind considerations,◐ Medium,✗ Not applicable,"Recharts 9/10, Chart.js 9/10, D3.js 10/10",2020s Modern,Medium,"Design a heatmap visualization. Use: color gradient scale (cool to hot), cell-based grid, intensity legend, hover tooltips, geographic or matrix layout, divergent color scheme for +/- values, accessible color alternatives.","display: grid, background: linear-gradient for legend, cell hover states, tooltip positioning, color scale (blue→white→red), SVG for geographic, canvas for large datasets","☐ Color scale clear, ☐ Legend visible, ☐ Tooltips informative, ☐ Colorblind alternatives, ☐ Zoom/pan for geo, ☐ Performance for large data","--heatmap-cool: #0080FF, --heatmap-neutral: #FFFFFF, --heatmap-hot: #FF0000, --cell-size: 24px, --legend-width: 200px, --tooltip-bg: rgba(0,0,0,0.9)"
30,Executive Dashboard,BI/Analytics,"High-level KPIs, large key metrics, minimal detail, summary view, trend indicators, at-a-glance insights, executive summary","Brand colors, professional palette (blue/grey/white), accent for KPIs, red for alerts/concerns","KPI highlight colors: positive (green), negative (red), neutral (grey), trend arrow colors","KPI value animations (count-up), trend arrow direction animations, metric card hover lift, alert pulse effect","C-suite dashboards, business summary reports, decision-maker dashboards, strategic planning views","Detailed analyst dashboards, technical deep-dives, operational monitoring",✓ Full,✓ Full,⚡ Excellent,✓ WCAG AA,✗ Low (not mobile-optimized),✗ Not applicable,"Recharts 9/10, Chart.js 9/10, D3.js 10/10",2020s Modern,Medium,"Design an executive dashboard. Use: large KPI cards (4-6 max), trend sparklines, high-level summary only, clean layout with white space, traffic light indicators (red/yellow/green), at-a-glance insights, minimal detail.","display: flex for KPI row, large font-size (24-48px) for metrics, sparkline SVG inline, status indicators (border-left color), card shadows for hierarchy, responsive breakpoints","☐ KPIs 4-6 maximum, ☐ Trends visible, ☐ Status colors clear, ☐ One-page view, ☐ Mobile simplified, ☐ Print-friendly layout","--kpi-font-size: 48px, --sparkline-height: 32px, --status-green: #22C55E, --status-yellow: #F59E0B, --status-red: #EF4444, --card-min-width: 280px"
31,Real-Time Monitoring,BI/Analytics,"Live data updates, status indicators, alert notifications, streaming data visualization, active monitoring, streaming charts","Alert colors: critical (red #FF0000), warning (orange #FFA500), normal (green #22C55E), updating (blue animation)","Status indicator colors, chart line colors varying by metric, streaming data highlight colors","Real-time chart animations, alert pulse/glow, status indicator blink animation, smooth data stream updates, loading effect","System monitoring dashboards, DevOps dashboards, real-time analytics, stock market dashboards, live event tracking","Historical analysis, long-term trend reports, archived data dashboards",✓ Full,✓ Full,⚡ Good (real-time load),✓ WCAG AA,◐ Medium,✗ Not applicable,"Recharts 9/10, Chart.js 9/10, D3.js 10/10",2020s Modern,Medium,"Design a real-time monitoring dashboard. Use: live status indicators (pulsing), streaming charts, alert notifications, connection status, auto-refresh indicators, critical alerts prominent, system health overview.","animation: pulse for live, WebSocket for streaming, position: fixed for alerts, status-dot with animation, chart real-time updates, notification toast, connection indicator","☐ Live updates working, ☐ Alert sounds optional, ☐ Connection status shown, ☐ Auto-refresh indicated, ☐ Critical alerts prominent, ☐ Offline fallback","--pulse-animation: pulse 2s infinite, --alert-z-index: 1000, --live-indicator: #22C55E, --critical-color: #DC2626, --update-interval: 5s, --toast-duration: 5s"
32,Drill-Down Analytics,BI/Analytics,"Hierarchical data exploration, expandable sections, interactive drill-down paths, summary-to-detail flow, context preservation","Primary brand, breadcrumb colors, drill-level indicator colors, hierarchy depth colors","Drill-down path indicator colors, level-specific colors, highlight colors for selected level, transition colors","Drill-down expand animations, breadcrumb click transitions, smooth detail reveal, level change smooth, data reload animation","Sales analytics, product analytics, funnel analysis, multi-dimensional data exploration, business intelligence","Simple linear data, single-metric dashboards, streaming real-time dashboards",✓ Full,✓ Full,⚡ Good,✓ WCAG AA,◐ Medium,✗ Not applicable,"Recharts 9/10, Chart.js 9/10, D3.js 10/10",2020s Modern,Medium,"Design a drill-down analytics dashboard. Use: breadcrumb navigation, expandable sections, summary-to-detail flow, back button prominent, level indicators, context preservation, hierarchical data display.","breadcrumb nav with separators, details/summary for expand, transition for drill animation, position: sticky breadcrumb, nested grid layouts, smooth scroll to detail","☐ Breadcrumbs clear, ☐ Back navigation easy, ☐ Expand animation smooth, ☐ Context preserved, ☐ Mobile drill works, ☐ Deep links supported","--breadcrumb-separator: /, --expand-duration: 300ms, --level-indent: 24px, --back-button-size: 40px, --context-bar-height: 48px, --drill-transition: 300ms ease"
33,Comparative Analysis Dashboard,BI/Analytics,"Side-by-side comparisons, period-over-period metrics, A/B test results, regional comparisons, performance benchmarks","Comparison colors: primary (blue), comparison (orange/purple), delta indicator (green/red)","Winning metric color (green), losing metric color (red), neutral comparison (grey), benchmark colors","Comparison bar animations (grow to value), delta indicator animations (direction arrows), highlight on compare","Period-over-period reporting, A/B test dashboards, market comparison, competitive analysis, regional performance","Single metric dashboards, future projections (use forecasting), real-time only (no historical)",✓ Full,✓ Full,⚡ Excellent,✓ WCAG AA,◐ Medium,✗ Not applicable,"Recharts 9/10, Chart.js 9/10, D3.js 10/10",2020s Modern,Medium,"Design a comparison dashboard. Use: side-by-side metrics, period selectors (vs last month), delta indicators (+/-), benchmark lines, A/B comparison tables, winning/losing highlights, percentage change badges.","display: flex for side-by-side, gap for comparison spacing, color coding (green up, red down), arrow indicators, diff highlighting, comparison table zebra striping","☐ Period selector works, ☐ Deltas calculated, ☐ Colors meaningful, ☐ Benchmarks shown, ☐ Mobile stacks properly, ☐ Export comparison","--positive-color: #22C55E, --negative-color: #EF4444, --neutral-color: #6B7280, --comparison-gap: 2rem, --arrow-size: 16px, --badge-padding: 4px 8px"
34,Predictive Analytics,BI/Analytics,"Forecast lines, confidence intervals, trend projections, scenario modeling, AI-driven insights, anomaly detection visualization","Forecast line color (distinct from actual), confidence interval shading, anomaly highlight (red alert), trend colors","High confidence (dark color), low confidence (light color), anomaly colors (red/orange), normal trend (green/blue)","Forecast line animation on draw, confidence band fade-in, anomaly pulse alert, smoothing function animations","Forecasting dashboards, anomaly detection systems, trend prediction dashboards, AI-powered analytics, budget planning","Historical-only dashboards, simple reporting, real-time operational dashboards",✓ Full,✓ Full,⚠ Good (computation),✓ WCAG AA,◐ Medium,✗ Not applicable,"Recharts 9/10, Chart.js 9/10, D3.js 10/10",2020s Modern,Medium,"Design a predictive analytics dashboard. Use: forecast lines (dashed), confidence intervals (shaded bands), trend projections, anomaly highlights, scenario toggles, AI insight cards, probability indicators.","stroke-dasharray for forecast lines, fill-opacity for confidence bands, anomaly markers (circles), tooltip for predictions, toggle switches for scenarios, gradient for probability","☐ Forecast line distinct, ☐ Confidence bands visible, ☐ Anomalies highlighted, ☐ Scenarios switchable, ☐ Predictions dated, ☐ Accuracy shown","--forecast-dash: 5 5, --confidence-opacity: 0.2, --anomaly-color: #F59E0B, --prediction-color: #8B5CF6, --scenario-toggle-width: 48px, --ai-accent: #6366F1"
