No,Style Category,Type,Keywords,Primary Colors,Secondary Colors,Effects & Animation,Best For,Do Not Use For,Light Mode ✓,Dark Mode ✓,Performance,Accessibility,Mobile-Friendly,Conversion-Focused,Framework Compatibility,Era/Origin,Complexity,AI Prompt Keywords,CSS/Technical Keywords,Implementation Checklist,Design System Variables
1,Minimalism & Swiss Style,General,"Clean, simple, spacious, functional, white space, high contrast, geometric, sans-serif, grid-based, essential","Monochromatic, Black #000000, White #FFFFFF","Neutral (Beige #F5F1E8, Grey #808080, Taupe #B38B6D), Primary accent","Subtle hover (200-250ms), smooth transitions, sharp shadows if any, clear type hierarchy, fast loading","Enterprise apps, dashboards, documentation sites, SaaS platforms, professional tools","Creative portfolios, entertainment, playful brands, artistic experiments",✓ Full,✓ Full,⚡ Excellent,✓ WCAG AAA,✓ High,◐ Medium,"Tailwind 10/10, Bootstrap 9/10, MUI 9/10",1950s Swiss,Low,"Design a minimalist landing page. Use: white space, geometric layouts, sans-serif fonts, high contrast, grid-based structure, essential elements only. Avoid shadows and gradients. Focus on clarity and functionality.","display: grid, gap: 2rem, font-family: sans-serif, color: #000 or #FFF, max-width: 1200px, clean borders, no box-shadow unless necessary","☐ Grid-based layout 12-16 columns, ☐ Typography hierarchy clear, ☐ No unnecessary decorations, ☐ WCAG AAA contrast verified, ☐ Mobile responsive grid","--spacing: 2rem, --border-radius: 0px, --font-weight: 400-700, --shadow: none, --accent-color: single primary only"
2,Neumorphism,General,"Soft UI, embossed, debossed, convex, concave, light source, subtle depth, rounded (12-16px), monochromatic","Light pastels: Soft Blue #C8E0F4, Soft Pink #F5E0E8, Soft Grey #E8E8E8","Tints/shades (±30%), gradient subtlety, color harmony","Soft box-shadow (multiple: -5px -5px 15px, 5px 5px 15px), smooth press (150ms), inner subtle shadow","Health/wellness apps, meditation platforms, fitness trackers, minimal interaction UIs","Complex apps, critical accessibility, data-heavy dashboards, high-contrast required",✓ Full,◐ Partial,⚡ Good,⚠ Low contrast,✓ Good,◐ Medium,"Tailwind 8/10, CSS-in-JS 9/10",2020s Modern,Medium,"Create a neumorphic UI with soft 3D effects. Use light pastels, rounded corners (12-16px), subtle soft shadows (multiple layers), no hard lines, monochromatic color scheme with light/dark variations. Embossed/debossed effect on interactive elements.","border-radius: 12-16px, box-shadow: -5px -5px 15px rgba(0,0,0,0.1), 5px 5px 15px rgba(255,255,255,0.8), background: linear-gradient(145deg, color1, color2), transform: scale on press","☐ Rounded corners 12-16px consistent, ☐ Multiple shadow layers (2-3), ☐ Pastel color verified, ☐ Monochromatic palette checked, ☐ Press animation smooth 150ms","--border-radius: 14px, --shadow-soft-1: -5px -5px 15px, --shadow-soft-2: 5px 5px 15px, --color-light: #F5F5F5, --color-primary: single pastel"
3,Glassmorphism,General,"Frosted glass, transparent, blurred background, layered, vibrant background, light source, depth, multi-layer","Translucent white: rgba(255,255,255,0.1-0.3)","Vibrant: Electric Blue #0080FF, Neon Purple #8B00FF, Vivid Pink #FF1493, Teal #20B2AA","Backdrop blur (10-20px), subtle border (1px solid rgba white 0.2), light reflection, Z-depth","Modern SaaS, financial dashboards, high-end corporate, lifestyle apps, modal overlays, navigation","Low-contrast backgrounds, critical accessibility, performance-limited, dark text on dark",✓ Full,✓ Full,⚠ Good,⚠ Ensure 4.5:1,✓ Good,✓ High,"Tailwind 9/10, MUI 8/10, Chakra 8/10",2020s Modern,Medium,"Design a glassmorphic interface with frosted glass effect. Use backdrop blur (10-20px), translucent overlays (rgba 10-30% opacity), vibrant background colors, subtle borders, light source reflection, layered depth. Perfect for modern overlays and cards.","backdrop-filter: blur(15px), background: rgba(255, 255, 255, 0.15), border: 1px solid rgba(255,255,255,0.2), -webkit-backdrop-filter: blur(15px), z-index layering for depth","☐ Backdrop-filter blur 10-20px, ☐ Translucent white 15-30% opacity, ☐ Subtle border 1px light, ☐ Vibrant background verified, ☐ Text contrast 4.5:1 checked","--blur-amount: 15px, --glass-opacity: 0.15, --border-color: rgba(255,255,255,0.2), --background: vibrant color, --text-color: light/dark based on BG"
4,Brutalism,General,"Raw, unpolished, stark, high contrast, plain text, default fonts, visible borders, asymmetric, anti-design","Primary: Red #FF0000, Blue #0000FF, Yellow #FFFF00, Black #000000, White #FFFFFF","Limited: Neon Green #00FF00, Hot Pink #FF00FF, minimal secondary","No smooth transitions (instant), sharp corners (0px), bold typography (700+), visible grid, large blocks","Design portfolios, artistic projects, counter-culture brands, editorial/media sites, tech blogs","Corporate environments, conservative industries, critical accessibility, customer-facing professional",✓ Full,✓ Full,⚡ Excellent,✓ WCAG AAA,◐ Medium,✗ Low,"Tailwind 10/10, Bootstrap 7/10",1950s Brutalist,Low,"Create a brutalist design with raw, unpolished, stark aesthetic. Use pure primary colors (red, blue, yellow), black & white, no smooth transitions (instant), sharp corners, bold large typography, visible grid lines, default system fonts, intentional 'broken' design elements.","border-radius: 0px, transition: none or 0s, font-family: system-ui or monospace, font-weight: 700+, border: visible 2-4px, colors: #FF0000, #0000FF, #FFFF00, #000000, #FFFFFF","☐ No border-radius (0px), ☐ No transitions (instant), ☐ Bold typography (700+), ☐ Pure primary colors used, ☐ Visible grid/borders, ☐ Asymmetric layout intentional","--border-radius: 0px, --transition-duration: 0s, --font-weight: 700-900, --colors: primary only, --border-style: visible, --grid-visible: true"
5,3D & Hyperrealism,General,"Depth, realistic textures, 3D models, spatial navigation, tactile, skeuomorphic elements, rich detail, immersive","Deep Navy #001F3F, Forest Green #228B22, Burgundy #800020, Gold #FFD700, Silver #C0C0C0","Complex gradients (5-10 stops), realistic lighting, shadow variations (20-40% darker)","WebGL/Three.js 3D, realistic shadows (layers), physics lighting, parallax (3-5 layers), smooth 3D (300-400ms)","Gaming, product showcase, immersive experiences, high-end e-commerce, architectural viz, VR/AR","Low-end mobile, performance-limited, critical accessibility, data tables/forms",◐ Partial,◐ Partial,❌ Poor,⚠ Not accessible,✗ Low,◐ Medium,"Three.js 10/10, R3F 10/10, Babylon.js 10/10",2020s Modern,High,"Build an immersive 3D interface using realistic textures, 3D models (Three.js/Babylon.js), complex shadows, realistic lighting, parallax scrolling (3-5 layers), physics-based motion. Include skeuomorphic elements with tactile detail.","transform: translate3d, perspective: 1000px, WebGL canvas, Three.js/Babylon.js library, box-shadow: complex multi-layer, background: complex gradients, filter: drop-shadow()","☐ WebGL/Three.js integrated, ☐ 3D models loaded, ☐ Parallax 3-5 layers, ☐ Realistic lighting verified, ☐ Complex shadows rendered, ☐ Physics animation smooth 300-400ms","--perspective: 1000px, --parallax-layers: 5, --lighting-intensity: realistic, --shadow-depth: 20-40%, --animation-duration: 300-400ms"
6,Vibrant & Block-based,General,"Bold, energetic, playful, block layout, geometric shapes, high color contrast, duotone, modern, energetic","Neon Green #39FF14, Electric Purple #BF00FF, Vivid Pink #FF1493, Bright Cyan #00FFFF, Sunburst #FFAA00","Complementary: Orange #FF7F00, Shocking Pink #FF006E, Lime #CCFF00, triadic schemes","Large sections (48px+ gaps), animated patterns, bold hover (color shift), scroll-snap, large type (32px+), 200-300ms","Startups, creative agencies, gaming, social media, youth-focused, entertainment, consumer","Financial institutions, healthcare, formal business, government, conservative, elderly",✓ Full,✓ Full,⚡ Good,◐ Ensure WCAG,✓ High,✓ High,"Tailwind 10/10, Chakra 9/10, Styled 9/10",2020s Modern,Medium,"Design an energetic, vibrant interface with bold block layouts, geometric shapes, high color contrast, large typography (32px+), animated background patterns, duotone effects. Perfect for startups and youth-focused apps. Use 4-6 contrasting colors from complementary/triadic schemes.","display: flex/grid with large gaps (48px+), font-size: 32px+, background: animated patterns (CSS), color: neon/vibrant colors, animation: continuous pattern movement","☐ Block layout with 48px+ gaps, ☐ Large typography 32px+, ☐ 4-6 vibrant colors max, ☐ Animated patterns active, ☐ Scroll-snap enabled, ☐ High contrast verified (7:1+)","--block-gap: 48px, --typography-size: 32px+, --color-palette: 4-6 vibrant colors, --animation: continuous pattern, --contrast-ratio: 7:1+"
7,Dark Mode (OLED),General,"Dark theme, low light, high contrast, deep black, midnight blue, eye-friendly, OLED, night mode, power efficient","Deep Black #000000, Dark Grey #121212, Midnight Blue #0A0E27","Vibrant accents: Neon Green #39FF14, Electric Blue #0080FF, Gold #FFD700, Plasma Purple #BF00FF","Minimal glow (text-shadow: 0 0 10px), dark-to-light transitions, low white emission, high readability, visible focus","Night-mode apps, coding platforms, entertainment, eye-strain prevention, OLED devices, low-light","Print-first content, high-brightness outdoor, color-accuracy-critical",✗ No,✓ Only,⚡ Excellent,✓ WCAG AAA,✓ High,◐ Low,"Tailwind 10/10, MUI 10/10, Chakra 10/10",2020s Modern,Low,"Create an OLED-optimized dark interface with deep black (#000000), dark grey (#121212), midnight blue accents. Use minimal glow effects, vibrant neon accents (green, blue, gold, purple), high contrast text. Optimize for eye comfort and OLED power saving.","background: #000000 or #121212, color: #FFFFFF or #E0E0E0, text-shadow: 0 0 10px neon-color (sparingly), filter: brightness(0.8) if needed, color-scheme: dark","☐ Deep black #000000 or #121212, ☐ Vibrant neon accents used, ☐ Text contrast 7:1+, ☐ Minimal glow effects, ☐ OLED power optimization, ☐ No white (#FFFFFF) background","--bg-black: #000000, --bg-dark-grey: #121212, --text-primary: #FFFFFF, --accent-neon: neon colors, --glow-effect: minimal, --oled-optimized: true"
8,Accessible & Ethical,General,"High contrast, large text (16px+), keyboard navigation, screen reader friendly, WCAG compliant, focus state, semantic","WCAG AA/AAA (4.5:1 min), simple primary, clear secondary, high luminosity (7:1+)","Symbol-based colors (not color-only), supporting patterns, inclusive combinations","Clear focus rings (3-4px), ARIA labels, skip links, responsive design, reduced motion, 44x44px touch targets","Government, healthcare, education, inclusive products, large audience, legal compliance, public",None - accessibility universal,✓ Full,✓ Full,⚡ Excellent,✓ WCAG AAA,✓ High,✓ High,All frameworks 10/10,Universal,Low,"Design with WCAG AAA compliance. Include: high contrast (7:1+), large text (16px+), keyboard navigation, screen reader compatibility, focus states visible (3-4px ring), semantic HTML, ARIA labels, skip links, reduced motion support (prefers-reduced-motion), 44x44px touch targets.","color-contrast: 7:1+, font-size: 16px+, outline: 3-4px on :focus-visible, aria-label, role attributes, @media (prefers-reduced-motion), touch-target: 44x44px, cursor: pointer","☐ WCAG AAA verified, ☐ 7:1+ contrast checked, ☐ Keyboard navigation tested, ☐ Screen reader tested, ☐ Focus visible 3-4px, ☐ Semantic HTML used, ☐ Touch targets 44x44px","--contrast-ratio: 7:1, --font-size-min: 16px, --focus-ring: 3-4px, --touch-target: 44x44px, --wcag-level: AAA, --keyboard-accessible: true, --sr-tested: true"
9,Claymorphism,General,"Soft 3D, chunky, playful, toy-like, bubbly, thick borders (3-4px), double shadows, rounded (16-24px)","Pastel: Soft Peach #FDBCB4, Baby Blue #ADD8E6, Mint #98FF98, Lilac #E6E6FA, light BG","Soft gradients (pastel-to-pastel), light/dark variations (20-30%), gradient subtle","Inner+outer shadows (subtle, no hard lines), soft press (200ms ease-out), fluffy elements, smooth transitions","Educational apps, children's apps, SaaS platforms, creative tools, fun-focused, onboarding, casual games","Formal corporate, professional services, data-critical, serious/medical, legal apps, finance",✓ Full,◐ Partial,⚡ Good,⚠ Ensure 4.5:1,✓ High,✓ High,"Tailwind 9/10, CSS-in-JS 9/10",2020s Modern,Medium,"Design a playful, toy-like interface with soft 3D, chunky elements, bubbly aesthetic, rounded edges (16-24px), thick borders (3-4px), double shadows (inner + outer), pastel colors, smooth animations. Perfect for children's apps and creative tools.","border-radius: 16-24px, border: 3-4px solid, box-shadow: inset -2px -2px 8px, 4px 4px 8px, background: pastel-gradient, animation: soft bounce (cubic-bezier 0.34, 1.56)","☐ Border-radius 16-24px, ☐ Thick borders 3-4px, ☐ Double shadows (inner+outer), ☐ Pastel colors used, ☐ Soft bounce animations, ☐ Playful interactions","--border-radius: 20px, --border-width: 3-4px, --shadow-inner: inset -2px -2px 8px, --shadow-outer: 4px 4px 8px, --color-palette: pastels, --animation: bounce"
10,Aurora UI,General,"Vibrant gradients, smooth blend, Northern Lights effect, mesh gradient, luminous, atmospheric, abstract","Complementary: Blue-Orange, Purple-Yellow, Electric Blue #0080FF, Magenta #FF1493, Cyan #00FFFF","Smooth transitions (Blue→Purple→Pink→Teal), iridescent effects, blend modes (screen, multiply)","Large flowing CSS/SVG gradients, subtle 8-12s animations, depth via color layering, smooth morph","Modern SaaS, creative agencies, branding, music platforms, lifestyle, premium products, hero sections","Data-heavy dashboards, critical accessibility, content-heavy where distraction issues",✓ Full,✓ Full,⚠ Good,⚠ Text contrast,✓ Good,✓ High,"Tailwind 9/10, CSS-in-JS 10/10",2020s Modern,Medium,"Create a vibrant gradient interface inspired by Northern Lights with mesh gradients, smooth color blends, flowing animations. Use complementary color pairs (blue-orange, purple-yellow), flowing background gradients, subtle continuous animations (8-12s loops), iridescent effects.","background: conic-gradient or radial-gradient with multiple stops, animation: @keyframes gradient (8-12s), background-size: 200% 200%, filter: saturate(1.2), blend-mode: screen or multiply","☐ Mesh/flowing gradients applied, ☐ 8-12s animation loop, ☐ Complementary colors used, ☐ Smooth color transitions, ☐ Iridescent effect subtle, ☐ Text contrast verified","--gradient-colors: complementary pairs, --animation-duration: 8-12s, --blend-mode: screen, --color-saturation: 1.2, --effect: iridescent, --loop-smooth: true"
11,Retro-Futurism,General,"Vintage sci-fi, 80s aesthetic, neon glow, geometric patterns, CRT scanlines, pixel art, cyberpunk, synthwave","Neon Blue #0080FF, Hot Pink #FF006E, Cyan #00FFFF, Deep Black #1A1A2E, Purple #5D34D0","Metallic Silver #C0C0C0, Gold #FFD700, duotone, 80s Pink #FF10F0, neon accents","CRT scanlines (::before overlay), neon glow (text-shadow+box-shadow), glitch effects (skew/offset keyframes)","Gaming, entertainment, music platforms, tech brands, artistic projects, nostalgic, cyberpunk","Conservative industries, critical accessibility, professional/corporate, elderly, legal/finance",✓ Full,✓ Dark focused,⚠ Moderate,⚠ High contrast/strain,◐ Medium,◐ Medium,"Tailwind 8/10, CSS-in-JS 9/10",1980s Retro,Medium,"Build a retro-futuristic (cyberpunk/vaporwave) interface with neon colors (blue, pink, cyan), deep black background, 80s aesthetic, CRT scanlines, glitch effects, neon glow text/borders, monospace fonts, geometric patterns. Use neon text-shadow and animated glitch effects.","color: neon colors (#0080FF, #FF006E, #00FFFF), text-shadow: 0 0 10px neon, background: #000 or #1A1A2E, font-family: monospace, animation: glitch (skew+offset), filter: hue-rotate","☐ Neon colors used, ☐ CRT scanlines effect, ☐ Glitch animations active, ☐ Monospace font, ☐ Deep black background, ☐ Glow effects applied, ☐ 80s patterns present","--neon-colors: #0080FF #FF006E #00FFFF, --background: #000000, --font-family: monospace, --effect: glitch+glow, --scanline-opacity: 0.3, --crt-effect: true"
12,Flat Design,General,"2D, minimalist, bold colors, no shadows, clean lines, simple shapes, typography-focused, modern, icon-heavy","Solid bright: Red, Orange, Blue, Green, limited palette (4-6 max)","Complementary colors, muted secondaries, high saturation, clean accents","No gradients/shadows, simple hover (color/opacity shift), fast loading, clean transitions (150-200ms ease), minimal icons","Web apps, mobile apps, cross-platform, startup MVPs, user-friendly, SaaS, dashboards, corporate","Complex 3D, premium/luxury, artistic portfolios, immersive experiences, high-detail",✓ Full,✓ Full,⚡ Excellent,✓ WCAG AAA,✓ High,✓ High,"Tailwind 10/10, Bootstrap 10/10, MUI 9/10",2010s Modern,Low,"Create a flat, 2D interface with bold colors, no shadows/gradients, clean lines, simple geometric shapes, icon-heavy, typography-focused, minimal ornamentation. Use 4-6 solid, bright colors in a limited palette with high saturation.","box-shadow: none, background: solid color, border-radius: 0-4px, color: solid (no gradients), fill: solid, stroke: 1-2px, font: bold sans-serif, icons: simplified SVG","☐ No shadows/gradients, ☐ 4-6 solid colors max, ☐ Clean lines consistent, ☐ Simple shapes used, ☐ Icon-heavy layout, ☐ High saturation colors, ☐ Fast loading verified","--shadow: none, --color-palette: 4-6 solid, --border-radius: 2px, --gradient: none, --icons: simplified SVG, --animation: minimal 150-200ms"
13,Skeuomorphism,General,"Realistic, texture, depth, 3D appearance, real-world metaphors, shadows, gradients, tactile, detailed, material","Rich realistic: wood, leather, metal colors, detailed gradients (8-12 stops), metallic effects","Realistic lighting gradients, shadow variations (30-50% darker), texture overlays, material colors","Realistic shadows (layers), depth (perspective), texture details (noise, grain), realistic animations (300-500ms)","Legacy apps, gaming, immersive storytelling, premium products, luxury, realistic simulations, education","Modern enterprise, critical accessibility, low-performance, web (use Flat/Modern)",◐ Partial,◐ Partial,❌ Poor,⚠ Textures reduce readability,✗ Low,◐ Medium,"CSS-in-JS 7/10, Custom 8/10",2007-2012 iOS,High,"Design a realistic, textured interface with 3D depth, real-world metaphors (leather, wood, metal), complex gradients (8-12 stops), realistic shadows, grain/texture overlays, tactile press animations. Perfect for premium/luxury products.","background: complex gradient (8-12 stops), box-shadow: realistic multi-layer, background-image: texture overlay (noise, grain), filter: drop-shadow, transform: scale on press (300-500ms)","☐ Realistic textures applied, ☐ Complex gradients 8-12 stops, ☐ Multi-layer shadows, ☐ Texture overlays present, ☐ Tactile animations smooth, ☐ Depth effect pronounced","--gradient-stops: 8-12, --texture-overlay: noise+grain, --shadow-layers: 3+, --animation-duration: 300-500ms, --depth-effect: pronounced, --tactile: true"
14,Liquid Glass,General,"Flowing glass, morphing, smooth transitions, fluid effects, translucent, animated blur, iridescent, chromatic aberration","Vibrant iridescent (rainbow spectrum), translucent base with opacity shifts, gradient fluidity","Chromatic aberration (Red-Cyan), iridescent oil-spill, fluid gradient blends, holographic effects","Morphing elements (SVG/CSS), fluid animations (400-600ms curves), dynamic blur (backdrop-filter), color transitions","Premium SaaS, high-end e-commerce, creative platforms, branding experiences, luxury portfolios","Performance-limited, critical accessibility, complex data, budget projects",✓ Full,✓ Full,⚠ Moderate-Poor,⚠ Text contrast,◐ Medium,✓ High,"Framer Motion 10/10, GSAP 10/10",2020s Modern,High,"Create a premium liquid glass effect with morphing shapes, flowing animations, chromatic aberration, iridescent gradients, smooth 400-600ms transitions. Use SVG morphing for shape changes, dynamic blur, smooth color transitions creating a fluid, premium feel.","animation: morphing SVG paths (400-600ms), backdrop-filter: blur + saturate, filter: hue-rotate + brightness, blend-mode: screen, background: iridescent gradient","☐ Morphing animations 400-600ms, ☐ Chromatic aberration applied, ☐ Dynamic blur active, ☐ Iridescent gradients, ☐ Smooth color transitions, ☐ Premium feel achieved","--morph-duration: 400-600ms, --blur-amount: 15px, --chromatic-aberration: true, --iridescent: true, --blend-mode: screen, --smooth-transitions: true"
15,Motion-Driven,General,"Animation-heavy, microinteractions, smooth transitions, scroll effects, parallax, entrance anim, page transitions","Bold colors emphasize movement, high contrast animated, dynamic gradients, accent action colors","Transitional states, success (Green #22C55E), error (Red #EF4444), neutral feedback","Scroll anim (Intersection Observer), hover (300-400ms), entrance, parallax (3-5 layers), page transitions","Portfolio sites, storytelling platforms, interactive experiences, entertainment apps, creative, SaaS","Data dashboards, critical accessibility, low-power devices, content-heavy, motion-sensitive",✓ Full,✓ Full,⚠ Good,⚠ Prefers-reduced-motion,✓ Good,✓ High,"GSAP 10/10, Framer Motion 10/10",2020s Modern,High,"Build an animation-heavy interface with scroll-triggered animations, microinteractions, parallax scrolling (3-5 layers), smooth transitions (300-400ms), entrance animations, page transitions. Use Intersection Observer for scroll effects, transform for performance, GPU acceleration.","animation: @keyframes scroll-reveal, transform: translateY/X, Intersection Observer API, will-change: transform, scroll-behavior: smooth, animation-duration: 300-400ms","☐ Scroll animations active, ☐ Parallax 3-5 layers, ☐ Entrance animations smooth, ☐ Page transitions fluid, ☐ GPU accelerated, ☐ Prefers-reduced-motion respected","--animation-duration: 300-400ms, --parallax-layers: 5, --scroll-behavior: smooth, --gpu-accelerated: true, --entrance-animation: true, --page-transition: smooth"
16,Micro-interactions,General,"Small animations, gesture-based, tactile feedback, subtle animations, contextual interactions, responsive","Subtle color shifts (10-20%), feedback: Green #22C55E, Red #EF4444, Amber #F59E0B","Accent feedback, neutral supporting, clear action indicators","Small hover (50-100ms), loading spinners, success/error state anim, gesture-triggered (swipe/pinch), haptic","Mobile apps, touchscreen UIs, productivity tools, user-friendly, consumer apps, interactive components","Desktop-only, critical performance, accessibility-first (alternatives needed)",✓ Full,✓ Full,⚡ Excellent,✓ Good,✓ High,✓ High,"Framer Motion 10/10, React Spring 9/10",2020s Modern,Medium,"Design with delightful micro-interactions: small 50-100ms animations, gesture-based responses, tactile feedback, loading spinners, success/error states, subtle hover effects, haptic feedback triggers for mobile. Focus on responsive, contextual interactions.","animation: short 50-100ms, transition: hover states, @media (hover: hover) for desktop, :active for press, haptic-feedback CSS/API, loading animation smooth loop","☐ Micro-animations 50-100ms, ☐ Gesture-responsive, ☐ Tactile feedback visual/haptic, ☐ Loading spinners smooth, ☐ Success/error states clear, ☐ Hover effects subtle","--micro-animation-duration: 50-100ms, --gesture-responsive: true, --haptic-feedback: true, --loading-animation: smooth, --state-feedback: success+error"
17,Inclusive Design,General,"Accessible, color-blind friendly, high contrast, haptic feedback, voice interaction, screen reader, WCAG AAA, universal","WCAG AAA (7:1+ contrast), avoid red-green only, symbol-based indicators, high contrast primary","Supporting patterns (stripes, dots, hatch), symbols, combinations, clear non-color indicators","Haptic feedback (vibration), voice guidance, focus indicators (4px+ ring), motion options, alt content, semantic","Public services, education, healthcare, finance, government, accessible consumer, inclusive",None - accessibility universal,✓ Full,✓ Full,⚡ Excellent,✓ WCAG AAA,✓ High,✓ High,All frameworks 10/10,Universal,Low,"Design for universal accessibility: high contrast (7:1+), large text (16px+), keyboard-only navigation, screen reader optimization, WCAG AAA compliance, symbol-based color indicators (not color-only), haptic feedback, voice interaction support, reduced motion options.","aria-* attributes complete, role attributes semantic, focus-visible: 3-4px ring, color-contrast: 7:1+, @media (prefers-reduced-motion), alt text on all images, form labels properly associated","☐ WCAG AAA verified, ☐ 7:1+ contrast all text, ☐ Keyboard accessible (Tab/Enter), ☐ Screen reader tested, ☐ Focus visible 3-4px, ☐ No color-only indicators, ☐ Haptic fallback","--contrast-ratio: 7:1, --font-size: 16px+, --keyboard-accessible: true, --sr-compatible: true, --wcag-level: AAA, --color-symbols: true, --haptic: enabled"
